"BiocVersion","SourceVersion","Coordinate_1_based","Species","TaxonomyId","SourceVersion.1","Genome","SourceUrl","DataProvider","Maintainer","Title","Description","SourceType","RDataClass","DispatchClass","RDataPath","Tags"
"3.13",NA,TRUE,"Homo sapiens","9606",2021-01-14 19:30:31,NA,"https://www.nature.com/articles/s41467-020-17541-6#Abs1",NA,"Sudarshan Shetty <sudarshanshetty9@gmail.com>","Sprockett Tsimane Horticulturalists microbiome counts","Count matrix for the Sprockett microbiome dataset","CSV","matrix","Rds","microbiomeDataSets/sprockett-th/counts.rds","Microbiome"
"3.13",NA,TRUE,"Homo sapiens","9606",2021-01-14 19:30:31,NA,"https://www.nature.com/articles/s41467-020-17541-6#Abs1",NA,"Sudarshan Shetty <sudarshanshetty9@gmail.com>","Sprockett Tsimane Horticulturalists row data","Row data for the Sprockett microbiome dataset","CSV","DFrame","Rds","microbiomeDataSets/sprockett-th/rowdata.rds","Microbiome"
"3.13",NA,TRUE,"Homo sapiens","9606",2021-01-14 19:30:31,NA,"https://www.nature.com/articles/s41467-020-17541-6#Abs1",NA,"Sudarshan Shetty <sudarshanshetty9@gmail.com>","Sprockett Tsimane Horticulturalists sample data","Sample data for the Sprockett dataset","CSV","DFrame","Rds","microbiomeDataSets/sprockett-th/coldata.rds","Microbiome"
"3.13",NA,TRUE,"Homo sapiens","9606",2021-01-14 19:30:31,NA,"https://www.nature.com/articles/s41467-020-17541-6#Abs1",NA,"Sudarshan Shetty <sudarshanshetty9@gmail.com>","Sprockett Tsimane Horticulturalists tree data","Feature tree data for the Sprockett dataset","TXT",NA,"FilePath","microbiomeDataSets/sprockett-th/rowtree.tre.gz","Microbiome"
"3.13",NA,TRUE,"Homo sapiens","9606",2021-01-14 19:30:31,NA,"https://www.nature.com/articles/s41467-020-17541-6#Abs1",NA,"Sudarshan Shetty <sudarshanshetty9@gmail.com>","Sprockett Tsimane Horticulturalists reference sequence data","Reference sequences data for the Sprockett dataset","TXT",NA,"FilePath","microbiomeDataSets/sprockett-th/refseq.fasta.gz","Microbiome"
