"BiocVersion","SourceVersion","Coordinate_1_based","Domain","TaxonomyId","SourceVersion.1","Genome","SourceUrl","DataProvider","Title","Description","SourceType","RDataClass","DispatchClass","RDataPath","Tags"
"3.14",NA,TRUE,"Bacteria","2",2021-08-12 13:01:45,NA,"https://science.sciencemag.org/content/373/6551/181",NA,"Counts","Count matrix for the bacteria microbiome dataset","Rds","DFrame","Rds","MicrobiomeDataSets/3.14/counts.rds","Microbiome"
"3.14",NA,TRUE,"Bacteria","2",2021-08-12 13:01:45,NA,"https://science.sciencemag.org/content/373/6551/181",NA,"Row data","Taxonomy table for the bacteria microbiome dataset","Rds","DFrame","Rds","MicrobiomeDataSets/3.14/rowdata.rds","Microbiome"
"3.14",NA,TRUE,"Bacteria","2",2021-08-12 13:01:45,NA,"https://science.sciencemag.org/content/373/6551/181",NA,"Phylogenetic tree","Phylogenetic tree for the bacteria microbiome dataset","Rds","Phylo","Tree.gz","MicrobiomeDataSets/3.14/rowtree.tre.gz","Microbiome"
"3.14",NA,TRUE,"Bacteria","2",2021-08-12 13:01:45,NA,"https://science.sciencemag.org/content/373/6551/181",NA,"Sample data","Sample Matrix for the bacteria microbiome dataset","Csv","DFrame","Rds","MicrobiomeDataSets/3.14/coldata.rds","Microbiome"
"3.14",NA,TRUE,"Bacteria","2",2021-08-12 13:01:45,NA,"https://science.sciencemag.org/content/373/6551/181",NA,"Sequence data","Sequence information the for bacteria microbiome dataset","Rds","DFrame","Fasta.gz","MicrobiomeDataSets/3.14/refseq.fasta.gz","Microbiome"
